{
  "age_restriction": "example-value",
  "age_restriction_description": "example-value",
  "also_ran": "example-value",
  "breed": "example-value",
  "distance_description": "example-value",
  "distance_unit": "example-value",
  "distance_value": "example-value",
  "fraction": "example-value",
  "grade": "example-value",
  "maximum_claim_price": "example-value",
  "minimum_claim_price": "example-value",
  "off_time": "example-value",
  "payoffs": "example-value",
  "post_time": "example-value",
  "post_time_long": "example-value",
  "race_class": "class_1",
  "race_key": "example-value",
  "race_name": "Example Name",
  "race_restriction": "example-value",
  "race_restriction_description": "example-value",
  "race_type": "flat",
  "race_type_description": "flat",
  "runners": "example-value",
  "scratches": "example-value",
  "sex_restriction": "example-value",
  "sex_restriction_description": "example-value",
  "surface": "example-value",
  "surface_description": "example-value",
  "time_zone": "example-value",
  "total_purse": "example-value",
  "track_condition_description": "example-value",
  "track_name": "Example Name",
  "wager_types": "flat"
}